============================================================
SEARCHING FOR p=5 KERNEL ELEMENTS (ULTRA-OPTIMIZED)
============================================================
Device: cuda
Bucket size: 1300000
Max length: 60
Bootstrap length: 5
Prime: 5
Degree multiplier: 4
Degree window: 481
Use best: 650000
Expansion chunk size: 50000
Matmul chunk size: 10000
⚡ Precomputed FFTs: ENABLED

Loaded tables from /nfs/roberts/project/pi_com36/com36/burau-experiments/precomputed_tables/tables_B4_r1_p5.pt
  Degree window: 481
✓ Identity matrix verified

Precomputing FFTs of simple Burau matrices...
  D=481, fft_size=1024
  FFT cache: 0.9 MB
Initialized with identity braid
Degree window: [-240, 240] (481 coefficients)
FFT size: 1024
Storage types: matrix=torch.int16, word=torch.int32
Config: bucket_size=1300000, bootstrap=5, max_length=60, chunk_size=50000, matmul_chunk=10000, use_best=650000
⚡ Ultra-optimized: precomputed Burau FFTs enabled

============================================================
Level 1 - BOOTSTRAP
============================================================
  Starting braids: 1
  Candidates to generate: 22
  Projlen distribution:
    projlen=3: 10 braids
    projlen=4: 12 braids
  Braids kept: 22 (in 2 buckets, 0.00 GB)
  ⚡ Timing: matmul=0.06s, sampling=0.00s, total=0.29s

============================================================
Level 2 - BOOTSTRAP
============================================================
  Starting braids: 22
  Candidates to generate: 164
  Projlen distribution:
    projlen=5: 56 braids
    projlen=6: 76 braids
    projlen=7: 32 braids
  Braids kept: 164 (in 3 buckets, 0.00 GB)
  ⚡ Timing: matmul=0.01s, sampling=0.00s, total=0.11s

============================================================
Level 3 - BOOTSTRAP
============================================================
  Starting braids: 164
  Candidates to generate: 982
  Projlen distribution:
    projlen=7: 270 braids
    projlen=8: 364 braids
    projlen=9: 288 braids
    projlen=10: 60 braids
  Braids kept: 982 (in 4 buckets, 0.01 GB)
  ⚡ Timing: matmul=0.01s, sampling=0.00s, total=0.10s

============================================================
Level 4 - BOOTSTRAP
============================================================
  Starting braids: 982
  Candidates to generate: 5528
  Projlen distribution:
    projlen=9: 1256 braids
    projlen=10: 1672 braids
    projlen=11: 1784 braids
    projlen=12: 700 braids
    projlen=13: 116 braids
  Braids kept: 5528 (in 5 buckets, 0.05 GB)
  ⚡ Timing: matmul=0.02s, sampling=0.00s, total=0.12s

============================================================
Level 5 - BOOTSTRAP
============================================================
  Starting braids: 5528
  Candidates to generate: 30478
  Projlen distribution:
    projlen=10: 4 braids
    projlen=11: 5798 braids
    projlen=12: 7672 braids
    projlen=13: 9864 braids
    projlen=14: 5236 braids
    projlen=15: 1716 braids
    projlen=16: 188 braids
  Braids kept: 30478 (in 7 buckets, 0.27 GB)
  ⚡ Timing: matmul=0.08s, sampling=0.00s, total=0.19s

============================================================
Level 6 - SAMPLING
============================================================
  Starting braids: 30478
  Candidates to generate: 166796
  Processing in 4 chunks...
  Projlen distribution:
    projlen=12: 68 braids
    projlen=13: 26768 braids
    projlen=14: 35288 braids
    projlen=15: 52292 braids
    projlen=16: 33012 braids
    projlen=17: 15680 braids
    projlen=18: 3356 braids
    projlen=19: 332 braids
  Braids kept: 166796 (in 8 buckets, 1.48 GB)
  ⚡ Timing: matmul=0.09s, sampling=0.01s, total=0.72s

============================================================
Level 7 - SAMPLING
============================================================
  Starting braids: 166796
  Candidates to generate: 910366
  Processing in 19 chunks...
  Projlen distribution:
    projlen=13: 52 braids
    projlen=14: 716 braids
    projlen=15: 123766 braids
    projlen=16: 162616 braids
    projlen=17: 271412 braids
    projlen=18: 191940 braids
    projlen=19: 116516 braids
    projlen=20: 35764 braids
    projlen=21: 7076 braids
    projlen=22: 508 braids
  Braids kept: 910366 (in 10 buckets, 8.10 GB)
  ⚡ Timing: matmul=0.31s, sampling=0.23s, total=3.80s

============================================================
Level 8 - SAMPLING
============================================================
  Starting braids: 650000
  Candidates to generate: 3601022
  Processing in 73 chunks...
  Projlen distribution:
    projlen=14: 112 braids
    projlen=15: 892 braids
    projlen=16: 6328 braids
    projlen=17: 571345 braids
    projlen=18: 743120 braids
    projlen=19: 1332690 braids
    projlen=20: 759134 braids
    projlen=21: 187401 braids
  Braids kept: 3568332 (in 8 buckets, 31.77 GB)
  ⚡ Timing: matmul=1.17s, sampling=3.17s, total=19.04s

============================================================
Level 9 - SAMPLING
============================================================
  Starting braids: 650000
  Candidates to generate: 3810800
  Processing in 77 chunks...
  Projlen distribution:
    projlen=15: 152 braids
    projlen=16: 1355 braids
    projlen=17: 11788 braids
    projlen=18: 37113 braids
    projlen=19: 2282782 braids
    projlen=20: 1320861 braids
    projlen=21: 156749 braids
  Braids kept: 2807157 (in 7 buckets, 24.99 GB)
  ⚡ Timing: matmul=1.31s, sampling=4.36s, total=21.90s

============================================================
Level 10 - SAMPLING
============================================================
  Starting braids: 650000
  Candidates to generate: 3925260
  Processing in 79 chunks...
  Projlen distribution:
    projlen=16: 64 braids
    projlen=17: 3038 braids
    projlen=18: 10724 braids
    projlen=19: 81598 braids
    projlen=20: 168384 braids
    projlen=21: 2442080 braids
    projlen=22: 1219372 braids
  Braids kept: 2783180 (in 7 buckets, 24.78 GB)
  ⚡ Timing: matmul=1.36s, sampling=5.47s, total=23.59s

============================================================
Level 11 - SAMPLING
============================================================
  Starting braids: 650000
  Candidates to generate: 3977768
  Processing in 80 chunks...
  Projlen distribution:
    projlen=16: 6 braids
    projlen=17: 101 braids
    projlen=18: 1456 braids
    projlen=19: 26549 braids
    projlen=20: 63228 braids
    projlen=21: 466400 braids
    projlen=22: 727263 braids
    projlen=23: 1895053 braids
    projlen=24: 797712 braids
  Braids kept: 3382715 (in 9 buckets, 30.11 GB)
  ⚡ Timing: matmul=1.38s, sampling=4.84s, total=23.02s

============================================================
Level 12 - SAMPLING
============================================================
  Starting braids: 650000
  Candidates to generate: 3985484
  Processing in 80 chunks...
  Projlen distribution:
    projlen=17: 4 braids
    projlen=18: 210 braids
    projlen=19: 2708 braids
    projlen=20: 12585 braids
    projlen=21: 166774 braids
    projlen=22: 317576 braids
    projlen=23: 2016866 braids
    projlen=24: 1256986 braids
    projlen=25: 211775 braids
  Braids kept: 3268618 (in 9 buckets, 29.10 GB)
  ⚡ Timing: matmul=1.47s, sampling=4.81s, total=23.65s

============================================================
Level 13 - SAMPLING
============================================================
  Starting braids: 650000
  Candidates to generate: 3892776
  Processing in 78 chunks...
  Projlen distribution:
    projlen=18: 38 braids
    projlen=19: 169 braids
    projlen=20: 2336 braids
    projlen=21: 26005 braids
    projlen=22: 76458 braids
    projlen=23: 846591 braids
    projlen=24: 1331354 braids
    projlen=25: 1299384 braids
    projlen=26: 310441 braids
  Braids kept: 3861422 (in 9 buckets, 34.37 GB)
  ⚡ Timing: matmul=1.64s, sampling=4.68s, total=23.94s

============================================================
Level 14 - SAMPLING
============================================================
  Starting braids: 650000
  Candidates to generate: 4004588
  Processing in 81 chunks...
  Projlen distribution:
    projlen=19: 75 braids
    projlen=20: 522 braids
    projlen=21: 3482 braids
    projlen=22: 18621 braids
    projlen=23: 161594 braids
    projlen=24: 365591 braids
    projlen=25: 2309464 braids
    projlen=26: 1145239 braids
  Braids kept: 2995124 (in 8 buckets, 26.66 GB)
  ⚡ Timing: matmul=1.37s, sampling=5.39s, total=24.30s

============================================================
Level 15 - SAMPLING
============================================================
  Starting braids: 650000
  Candidates to generate: 3935094
  Processing in 79 chunks...
  Projlen distribution:
    projlen=19: 38 braids
    projlen=20: 138 braids
    projlen=21: 1397 braids
    projlen=22: 5380 braids
    projlen=23: 31828 braids
    projlen=24: 109901 braids
    projlen=25: 834476 braids
    projlen=26: 1527301 braids
    projlen=27: 1216495 braids
    projlen=28: 208140 braids
  Braids kept: 3707793 (in 10 buckets, 33.01 GB)
  ⚡ Timing: matmul=1.40s, sampling=4.19s, total=21.94s

============================================================
Level 16 - SAMPLING
============================================================
  Starting braids: 650000
  Candidates to generate: 3980718
  Processing in 80 chunks...
  Projlen distribution:
    projlen=20: 80 braids
    projlen=21: 767 braids
    projlen=22: 2335 braids
    projlen=23: 12995 braids
    projlen=24: 40044 braids
    projlen=25: 190810 braids
    projlen=26: 507702 braids
    projlen=27: 2170837 braids
    projlen=28: 1055148 braids
  Braids kept: 3109881 (in 9 buckets, 27.68 GB)
  ⚡ Timing: matmul=1.73s, sampling=6.43s, total=26.21s

============================================================
Level 17 - SAMPLING
============================================================
  Starting braids: 650000
  Candidates to generate: 3904320
  Processing in 79 chunks...
  Projlen distribution:
    projlen=20: 42 braids
    projlen=21: 284 braids
    projlen=22: 1456 braids
    projlen=23: 7596 braids
    projlen=24: 19960 braids
    projlen=25: 90400 braids
    projlen=26: 217059 braids
    projlen=27: 929470 braids
    projlen=28: 1750981 braids
    projlen=29: 887072 braids
  Braids kept: 3453339 (in 10 buckets, 30.74 GB)
  ⚡ Timing: matmul=1.35s, sampling=4.12s, total=21.72s

============================================================
Level 18 - SAMPLING
============================================================
  Starting braids: 650000
  Candidates to generate: 3897028
  Processing in 78 chunks...
  Projlen distribution:
    projlen=21: 99 braids
    projlen=22: 710 braids
    projlen=23: 4381 braids
    projlen=24: 13711 braids
    projlen=25: 58840 braids
    projlen=26: 122456 braids
    projlen=27: 468043 braids
    projlen=28: 951106 braids
    projlen=29: 1620437 braids
    projlen=30: 657245 braids
  Braids kept: 3576591 (in 10 buckets, 31.84 GB)
  ⚡ Timing: matmul=1.41s, sampling=3.91s, total=21.13s

============================================================
Level 19 - SAMPLING
============================================================
  Starting braids: 650000
  Candidates to generate: 3893542
  Processing in 78 chunks...
  Projlen distribution:
    projlen=21: 22 braids
    projlen=22: 349 braids
    projlen=23: 2595 braids
    projlen=24: 8189 braids
    projlen=25: 39953 braids
    projlen=26: 88396 braids
    projlen=27: 336942 braids
    projlen=28: 591913 braids
    projlen=29: 1901746 braids
    projlen=30: 923437 braids
  Braids kept: 3291796 (in 10 buckets, 29.30 GB)
  ⚡ Timing: matmul=1.66s, sampling=5.40s, total=24.85s

============================================================
Level 20 - SAMPLING
============================================================
  Starting braids: 650000
  Candidates to generate: 3813194
  Processing in 77 chunks...
  Projlen distribution:
    projlen=21: 8 braids
    projlen=22: 197 braids
    projlen=23: 1344 braids
    projlen=24: 5258 braids
    projlen=25: 27291 braids
    projlen=26: 58810 braids
    projlen=27: 246780 braids
    projlen=28: 436663 braids
    projlen=29: 1452485 braids
    projlen=30: 1210689 braids
  Braids kept: 3660709 (in 11 buckets, 32.59 GB)
  ⚡ Timing: matmul=1.33s, sampling=4.75s, total=22.29s

============================================================
Level 21 - SAMPLING
============================================================
  Starting braids: 650000
  Candidates to generate: 3758496
  Processing in 76 chunks...
  Projlen distribution:
    projlen=21: 45 braids
    projlen=22: 138 braids
    projlen=23: 1033 braids
    projlen=24: 3529 braids
    projlen=25: 16305 braids
    projlen=26: 41004 braids
    projlen=27: 179162 braids
    projlen=28: 304672 braids
    projlen=29: 1125666 braids
    projlen=30: 1427315 braids
  Braids kept: 3631181 (in 11 buckets, 32.32 GB)
  ⚡ Timing: matmul=1.31s, sampling=3.54s, total=20.12s

============================================================
Level 22 - SAMPLING
============================================================
  Starting braids: 650000
  Candidates to generate: 3717674
  Processing in 75 chunks...
  Projlen distribution:
    projlen=20: 6 braids
    projlen=21: 112 braids
    projlen=22: 167 braids
    projlen=23: 874 braids
    projlen=24: 2449 braids
    projlen=25: 12620 braids
    projlen=26: 29565 braids
    projlen=27: 117082 braids
    projlen=28: 225260 braids
    projlen=29: 851553 braids
  Braids kept: 3717674 (in 13 buckets, 33.09 GB)
  ⚡ Timing: matmul=1.27s, sampling=3.43s, total=21.53s

============================================================
Level 23 - SAMPLING
============================================================
  Starting braids: 650000
  Candidates to generate: 3741178
  Processing in 75 chunks...
  Projlen distribution:
    projlen=20: 29 braids
    projlen=21: 177 braids
    projlen=22: 228 braids
    projlen=23: 1232 braids
    projlen=24: 2105 braids
    projlen=25: 9607 braids
    projlen=26: 22098 braids
    projlen=27: 92409 braids
    projlen=28: 173952 braids
    projlen=29: 571221 braids
  Braids kept: 3638273 (in 13 buckets, 32.39 GB)
  ⚡ Timing: matmul=1.41s, sampling=3.40s, total=19.99s

============================================================
Level 24 - SAMPLING
============================================================
  Starting braids: 650000
  Candidates to generate: 3742702
  Processing in 75 chunks...
  Projlen distribution:
    projlen=20: 32 braids
    projlen=21: 194 braids
    projlen=22: 362 braids
    projlen=23: 1408 braids
    projlen=24: 1921 braids
    projlen=25: 10152 braids
    projlen=26: 18220 braids
    projlen=27: 72557 braids
    projlen=28: 138127 braids
    projlen=29: 471680 braids
  Braids kept: 3460389 (in 13 buckets, 30.80 GB)
  ⚡ Timing: matmul=1.34s, sampling=3.76s, total=20.59s

============================================================
Level 25 - SAMPLING
============================================================
  Starting braids: 650000
  Candidates to generate: 3751116
  Processing in 76 chunks...
  Projlen distribution:
    projlen=19: 4 braids
    projlen=20: 25 braids
    projlen=21: 166 braids
    projlen=22: 374 braids
    projlen=23: 1511 braids
    projlen=24: 2589 braids
    projlen=25: 9169 braids
    projlen=26: 15198 braids
    projlen=27: 70458 braids
    projlen=28: 118598 braids
  Braids kept: 3341792 (in 14 buckets, 29.75 GB)
  ⚡ Timing: matmul=1.29s, sampling=3.99s, total=20.85s

============================================================
Level 26 - SAMPLING
============================================================
  Starting braids: 650000
  Candidates to generate: 3761840
  Processing in 76 chunks...
  Projlen distribution:
    projlen=20: 9 braids
    projlen=21: 104 braids
    projlen=22: 245 braids
    projlen=23: 1528 braids
    projlen=24: 2270 braids
    projlen=25: 9943 braids
    projlen=26: 17175 braids
    projlen=27: 59466 braids
    projlen=28: 98128 braids
    projlen=29: 395703 braids
  Braids kept: 3406767 (in 14 buckets, 30.33 GB)
  ⚡ Timing: matmul=1.32s, sampling=4.26s, total=21.26s

============================================================
Level 27 - SAMPLING
============================================================
  Starting braids: 650000
  Candidates to generate: 3763386
  Processing in 76 chunks...
  Projlen distribution:
    projlen=20: 3 braids
    projlen=21: 16 braids
    projlen=22: 69 braids
    projlen=23: 1050 braids
    projlen=24: 1877 braids
    projlen=25: 9747 braids
    projlen=26: 14741 braids
    projlen=27: 62505 braids
    projlen=28: 104293 braids
    projlen=29: 338000 braids
  Braids kept: 3417529 (in 14 buckets, 30.42 GB)
  ⚡ Timing: matmul=1.31s, sampling=4.96s, total=22.17s

============================================================
Level 28 - SAMPLING
============================================================
  Starting braids: 650000
  Candidates to generate: 3725790
  Processing in 75 chunks...
  Projlen distribution:
    projlen=20: 9 braids
    projlen=21: 16 braids
    projlen=22: 97 braids
    projlen=23: 368 braids
    projlen=24: 945 braids
    projlen=25: 7089 braids
    projlen=26: 12668 braids
    projlen=27: 59375 braids
    projlen=28: 91463 braids
    projlen=29: 351170 braids
  Braids kept: 3579272 (in 14 buckets, 31.86 GB)
  ⚡ Timing: matmul=1.29s, sampling=4.25s, total=20.97s

============================================================
Level 29 - SAMPLING
============================================================
  Starting braids: 650000
  Candidates to generate: 3726744
  Processing in 75 chunks...
  Projlen distribution:
    projlen=19: 14 braids
    projlen=20: 12 braids
    projlen=21: 49 braids
    projlen=22: 110 braids
    projlen=23: 411 braids
    projlen=24: 1043 braids
    projlen=25: 3453 braids
    projlen=26: 7741 braids
    projlen=27: 44846 braids
    projlen=28: 78521 braids
  Braids kept: 3536157 (in 15 buckets, 31.48 GB)
  ⚡ Timing: matmul=1.33s, sampling=4.35s, total=21.18s

============================================================
Level 30 - SAMPLING
============================================================
  Starting braids: 650000
  Candidates to generate: 3718542
  Processing in 75 chunks...
  Projlen distribution:
    projlen=19: 7 braids
    projlen=20: 65 braids
    projlen=21: 85 braids
    projlen=22: 252 braids
    projlen=23: 556 braids
    projlen=24: 1090 braids
    projlen=25: 3736 braids
    projlen=26: 7731 braids
    projlen=27: 25983 braids
    projlen=28: 52970 braids
  Braids kept: 3587826 (in 15 buckets, 31.94 GB)
  ⚡ Timing: matmul=1.30s, sampling=5.15s, total=23.77s

============================================================
Level 31 - SAMPLING
============================================================
  Starting braids: 650000
  Candidates to generate: 3733926
  Processing in 75 chunks...
  Projlen distribution:
    projlen=18: 2 braids
    projlen=19: 11 braids
    projlen=20: 68 braids
    projlen=21: 145 braids
    projlen=22: 505 braids
    projlen=23: 842 braids
    projlen=24: 1736 braids
    projlen=25: 4470 braids
    projlen=26: 8215 braids
    projlen=27: 26484 braids
  Braids kept: 3655204 (in 16 buckets, 32.54 GB)
  ⚡ Timing: matmul=1.31s, sampling=3.19s, total=19.36s

============================================================
Level 32 - SAMPLING
============================================================
  Starting braids: 650000
  Candidates to generate: 3769316
  Processing in 76 chunks...
  Projlen distribution:
    projlen=18: 10 braids
    projlen=19: 22 braids
    projlen=20: 33 braids
    projlen=21: 190 braids
    projlen=22: 504 braids
    projlen=23: 1188 braids
    projlen=24: 2975 braids
    projlen=25: 5880 braids
    projlen=26: 11562 braids
    projlen=27: 29594 braids
  Braids kept: 3769316 (in 17 buckets, 33.55 GB)
  ⚡ Timing: matmul=1.31s, sampling=3.23s, total=19.95s

============================================================
Level 33 - SAMPLING
============================================================
  Starting braids: 650000
  Candidates to generate: 3743236
  Processing in 75 chunks...
  Projlen distribution:
    projlen=17: 2 braids
    projlen=18: 6 braids
    projlen=19: 24 braids
    projlen=20: 56 braids
    projlen=21: 167 braids
    projlen=22: 380 braids
    projlen=23: 1285 braids
    projlen=24: 3082 braids
    projlen=25: 7503 braids
    projlen=26: 18037 braids
  Braids kept: 3743236 (in 18 buckets, 33.32 GB)
  ⚡ Timing: matmul=1.38s, sampling=3.13s, total=19.51s

============================================================
Level 34 - SAMPLING
============================================================
  Starting braids: 650000
  Candidates to generate: 3679376
  Processing in 74 chunks...
  Projlen distribution:
    projlen=18: 9 braids
    projlen=19: 16 braids
    projlen=20: 49 braids
    projlen=21: 151 braids
    projlen=22: 352 braids
    projlen=23: 1125 braids
    projlen=24: 2558 braids
    projlen=25: 7954 braids
    projlen=26: 18514 braids
    projlen=27: 45603 braids
  Braids kept: 3679376 (in 17 buckets, 32.75 GB)
  ⚡ Timing: matmul=1.28s, sampling=3.11s, total=19.00s

============================================================
Level 35 - SAMPLING
============================================================
  Starting braids: 650000
  Candidates to generate: 3667668
  Processing in 74 chunks...
  Projlen distribution:
    projlen=17: 2 braids
    projlen=18: 6 braids
    projlen=19: 14 braids
    projlen=20: 64 braids
    projlen=21: 111 braids
    projlen=22: 355 braids
    projlen=23: 987 braids
    projlen=24: 2091 braids
    projlen=25: 6942 braids
    projlen=26: 16640 braids
  Braids kept: 3667668 (in 17 buckets, 32.65 GB)
  ⚡ Timing: matmul=1.27s, sampling=3.36s, total=19.38s

============================================================
Level 36 - SAMPLING
============================================================
  Starting braids: 650000
  Candidates to generate: 3703156
  Processing in 75 chunks...
  Projlen distribution:
    projlen=17: 2 braids
    projlen=18: 7 braids
    projlen=19: 14 braids
    projlen=20: 43 braids
    projlen=21: 101 braids
    projlen=22: 365 braids
    projlen=23: 826 braids
    projlen=24: 2368 braids
    projlen=25: 6004 braids
    projlen=26: 13519 braids
  Braids kept: 3703156 (in 17 buckets, 32.97 GB)
  ⚡ Timing: matmul=1.28s, sampling=3.22s, total=19.27s

============================================================
Level 37 - SAMPLING
============================================================
  Starting braids: 650000
  Candidates to generate: 3725212
  Processing in 75 chunks...
  Projlen distribution:
    projlen=18: 7 braids
    projlen=19: 20 braids
    projlen=20: 59 braids
    projlen=21: 98 braids
    projlen=22: 239 braids
    projlen=23: 641 braids
    projlen=24: 2306 braids
    projlen=25: 5269 braids
    projlen=26: 15239 braids
    projlen=27: 37976 braids
  Braids kept: 3725212 (in 16 buckets, 33.16 GB)
  ⚡ Timing: matmul=1.34s, sampling=4.40s, total=22.02s

============================================================
Level 38 - SAMPLING
============================================================
  Starting braids: 650000
  Candidates to generate: 3744594
  Processing in 75 chunks...
  Projlen distribution:
    projlen=19: 3 braids
    projlen=20: 73 braids
    projlen=21: 157 braids
    projlen=22: 323 braids
    projlen=23: 578 braids
    projlen=24: 1523 braids
    projlen=25: 4540 braids
    projlen=26: 14172 braids
    projlen=27: 34251 braids
    projlen=28: 93679 braids
  Braids kept: 3730727 (in 15 buckets, 33.21 GB)
  ⚡ Timing: matmul=1.49s, sampling=3.72s, total=20.50s

============================================================
Level 39 - SAMPLING
============================================================
  Starting braids: 650000
  Candidates to generate: 3752680
  Processing in 76 chunks...
  Projlen distribution:
    projlen=20: 10 braids
    projlen=21: 59 braids
    projlen=22: 482 braids
    projlen=23: 1013 braids
    projlen=24: 2016 braids
    projlen=25: 3986 braids
    projlen=26: 10302 braids
    projlen=27: 31045 braids
    projlen=28: 86083 braids
    projlen=29: 204663 braids
  Braids kept: 3704051 (in 14 buckets, 32.97 GB)
  ⚡ Timing: matmul=1.28s, sampling=3.51s, total=20.88s

============================================================
Level 40 - SAMPLING
============================================================
  Starting braids: 650000
  Candidates to generate: 3785940
  Processing in 76 chunks...
  Projlen distribution:
    projlen=19: 2 braids
    projlen=20: 4 braids
    projlen=21: 20 braids
    projlen=22: 110 braids
    projlen=23: 550 braids
    projlen=24: 3104 braids
    projlen=25: 6435 braids
    projlen=26: 13035 braids
    projlen=27: 27625 braids
    projlen=28: 66876 braids
  Braids kept: 3629501 (in 15 buckets, 32.31 GB)
  ⚡ Timing: matmul=1.33s, sampling=3.53s, total=20.09s

============================================================
Level 41 - SAMPLING
============================================================
  Starting braids: 650000
  Candidates to generate: 3795250
  Processing in 76 chunks...
  Projlen distribution:
    projlen=19: 2 braids
    projlen=20: 7 braids
    projlen=21: 14 braids
    projlen=22: 71 braids
    projlen=23: 272 braids
    projlen=24: 1227 braids
    projlen=25: 4699 braids
    projlen=26: 18539 braids
    projlen=27: 39896 braids
    projlen=28: 80354 braids
  Braids kept: 3566219 (in 15 buckets, 31.75 GB)
  ⚡ Timing: matmul=1.37s, sampling=3.77s, total=20.59s

============================================================
Level 42 - SAMPLING
============================================================
  Starting braids: 650000
  Candidates to generate: 3761638
  Processing in 76 chunks...
  Projlen distribution:
    projlen=20: 10 braids
    projlen=21: 19 braids
    projlen=22: 66 braids
    projlen=23: 190 braids
    projlen=24: 1097 braids
    projlen=25: 3413 braids
    projlen=26: 10246 braids
    projlen=27: 32993 braids
    projlen=28: 105889 braids
    projlen=29: 227944 braids
  Braids kept: 3619819 (in 14 buckets, 32.22 GB)
  ⚡ Timing: matmul=1.31s, sampling=4.12s, total=20.78s

============================================================
Level 43 - SAMPLING
============================================================
  Starting braids: 650000
  Candidates to generate: 3733186
  Processing in 75 chunks...
  Projlen distribution:
    projlen=20: 10 braids
    projlen=21: 28 braids
    projlen=22: 91 braids
    projlen=23: 235 braids
    projlen=24: 910 braids
    projlen=25: 2944 braids
    projlen=26: 9835 braids
    projlen=27: 27168 braids
    projlen=28: 70616 braids
    projlen=29: 198671 braids
  Braids kept: 3711070 (in 14 buckets, 33.04 GB)
  ⚡ Timing: matmul=1.30s, sampling=3.23s, total=19.49s

============================================================
Level 44 - SAMPLING
============================================================
  Starting braids: 650000
  Candidates to generate: 3788102
  Processing in 76 chunks...
  Projlen distribution:
    projlen=19: 2 braids
    projlen=20: 4 braids
    projlen=21: 33 braids
    projlen=22: 111 braids
    projlen=23: 302 braids
    projlen=24: 996 braids
    projlen=25: 2809 braids
    projlen=26: 8086 braids
    projlen=27: 24055 braids
    projlen=28: 69445 braids
  Braids kept: 3542399 (in 15 buckets, 31.53 GB)
  ⚡ Timing: matmul=1.34s, sampling=4.17s, total=21.03s

============================================================
Level 45 - SAMPLING
============================================================
  Starting braids: 650000
  Candidates to generate: 3787812
  Processing in 76 chunks...
  Projlen distribution:
    projlen=18: 2 braids
    projlen=19: 8 braids
    projlen=20: 20 braids
    projlen=21: 56 braids
    projlen=22: 128 braids
    projlen=23: 368 braids
    projlen=24: 1207 braids
    projlen=25: 2755 braids
    projlen=26: 7618 braids
    projlen=27: 22447 braids
  Braids kept: 3516526 (in 16 buckets, 31.30 GB)
  ⚡ Timing: matmul=1.66s, sampling=4.89s, total=22.79s

============================================================
Level 46 - SAMPLING
============================================================
  Starting braids: 650000
  Candidates to generate: 3784618
  Processing in 76 chunks...
  Projlen distribution:
    projlen=17: 6 braids
    projlen=18: 15 braids
    projlen=19: 52 braids
    projlen=20: 56 braids
    projlen=21: 94 braids
    projlen=22: 245 braids
    projlen=23: 575 braids
    projlen=24: 1317 braids
    projlen=25: 3316 braids
    projlen=26: 8335 braids
  Braids kept: 3480997 (in 18 buckets, 30.99 GB)
  ⚡ Timing: matmul=1.31s, sampling=3.75s, total=20.50s

============================================================
Level 47 - SAMPLING
============================================================
  Starting braids: 650000
  Candidates to generate: 3781486
  Processing in 76 chunks...
  Projlen distribution:
    projlen=15: 6 braids
    projlen=16: 5 braids
    projlen=17: 32 braids
    projlen=18: 61 braids
    projlen=19: 79 braids
    projlen=20: 146 braids
    projlen=21: 320 braids
    projlen=22: 392 braids
    projlen=23: 837 braids
    projlen=24: 1843 braids
  Braids kept: 3680890 (in 20 buckets, 32.77 GB)
  ⚡ Timing: matmul=1.32s, sampling=3.83s, total=20.67s

============================================================
Level 48 - SAMPLING
============================================================
  Starting braids: 650000
  Candidates to generate: 3787798
  Processing in 76 chunks...
  Projlen distribution:
    projlen=13: 6 braids
    projlen=14: 5 braids
    projlen=15: 24 braids
    projlen=16: 34 braids
    projlen=17: 56 braids
    projlen=18: 45 braids
    projlen=19: 219 braids
    projlen=20: 350 braids
    projlen=21: 528 braids
    projlen=22: 832 braids
  Braids kept: 3743681 (in 22 buckets, 33.33 GB)
  ⚡ Timing: matmul=1.32s, sampling=3.85s, total=20.65s

============================================================
Level 49 - SAMPLING
============================================================
  Starting braids: 650000
  Candidates to generate: 3766530
  Processing in 76 chunks...
  Projlen distribution:
    projlen=11: 6 braids
    projlen=12: 3 braids
    projlen=13: 28 braids
    projlen=14: 18 braids
    projlen=15: 54 braids
    projlen=16: 38 braids
    projlen=17: 148 braids
    projlen=18: 180 braids
    projlen=19: 339 braids
    projlen=20: 242 braids
  Braids kept: 3668951 (in 24 buckets, 32.66 GB)
  ⚡ Timing: matmul=1.29s, sampling=3.87s, total=20.67s

============================================================
Level 50 - SAMPLING
============================================================
  Starting braids: 650000
  Candidates to generate: 3750592
  Processing in 76 chunks...
  Projlen distribution:
    projlen=9: 6 braids
    projlen=10: 4 braids
    projlen=11: 31 braids
    projlen=12: 20 braids
    projlen=13: 68 braids
    projlen=14: 42 braids
    projlen=15: 164 braids
    projlen=16: 116 braids
    projlen=17: 300 braids
    projlen=18: 170 braids
  Braids kept: 3662254 (in 25 buckets, 32.60 GB)
  ⚡ Timing: matmul=1.27s, sampling=3.60s, total=20.14s

============================================================
Level 51 - SAMPLING
============================================================
  Starting braids: 650000
  Candidates to generate: 3704488
  Processing in 75 chunks...
  Projlen distribution:
    projlen=7: 6 braids
    projlen=8: 2 braids
    projlen=9: 33 braids
    projlen=10: 15 braids
    projlen=11: 84 braids
    projlen=12: 43 braids
    projlen=13: 206 braids
    projlen=14: 122 braids
    projlen=15: 410 braids
    projlen=16: 202 braids
  Braids kept: 3704488 (in 27 buckets, 32.98 GB)
  ⚡ Timing: matmul=1.29s, sampling=3.32s, total=19.53s

============================================================
Level 52 - SAMPLING
============================================================
  Starting braids: 650000
  Candidates to generate: 3657952
  Processing in 74 chunks...
  Projlen distribution:
    projlen=5: 6 braids
    projlen=6: 4 braids
    projlen=7: 31 braids
    projlen=8: 20 braids
    projlen=9: 69 braids
    projlen=10: 42 braids
    projlen=11: 188 braids
    projlen=12: 122 braids
    projlen=13: 466 braids
    projlen=14: 238 braids
  Braids kept: 3657952 (in 28 buckets, 32.56 GB)
  ⚡ Timing: matmul=1.27s, sampling=3.11s, total=18.93s

============================================================
Level 53 - SAMPLING
============================================================
  Starting braids: 650000
  Candidates to generate: 3615962
  Processing in 73 chunks...
  Projlen distribution:
    projlen=3: 6 braids
    projlen=5: 37 braids
    projlen=6: 17 braids
    projlen=7: 82 braids
    projlen=8: 49 braids
    projlen=9: 212 braids
    projlen=10: 114 braids
    projlen=11: 414 braids
    projlen=12: 184 braids
    projlen=13: 1040 braids
  Braids kept: 3615962 (in 29 buckets, 32.19 GB)
  ⚡ Timing: matmul=1.25s, sampling=2.88s, total=18.41s

============================================================
Level 54 - SAMPLING
============================================================
  Starting braids: 650000
  Candidates to generate: 3601172
  Processing in 73 chunks...

  🎉 FOUND 6 KERNEL ELEMENTS (projlen=1)! 🎉
  Projlen distribution:
    projlen=1: 6 braids
    projlen=3: 29 braids
    projlen=4: 28 braids
    projlen=5: 45 braids
    projlen=6: 66 braids
    projlen=7: 188 braids
    projlen=8: 144 braids
    projlen=9: 453 braids
    projlen=10: 269 braids
    projlen=11: 1172 braids
  Braids kept: 3601172 (in 30 buckets, 32.06 GB)
  ⚡ Timing: matmul=1.23s, sampling=2.39s, total=17.58s

============================================================
Level 55 - SAMPLING
============================================================
  Starting braids: 650000
  Candidates to generate: 3573338
  Processing in 72 chunks...

  🎉 FOUND 5 KERNEL ELEMENTS (projlen=1)! 🎉
  Projlen distribution:
    projlen=1: 5 braids
    projlen=3: 50 braids
    projlen=4: 54 braids
    projlen=5: 141 braids
    projlen=6: 175 braids
    projlen=7: 301 braids
    projlen=8: 309 braids
    projlen=9: 1054 braids
    projlen=10: 711 braids
    projlen=11: 2426 braids
  Braids kept: 3573338 (in 28 buckets, 31.81 GB)
  ⚡ Timing: matmul=1.23s, sampling=2.52s, total=17.54s

============================================================
Level 56 - SAMPLING
============================================================
  Starting braids: 650000
  Candidates to generate: 3604854
  Processing in 73 chunks...
  Projlen distribution:
    projlen=3: 25 braids
    projlen=4: 50 braids
    projlen=5: 252 braids
    projlen=6: 314 braids
    projlen=7: 741 braids
    projlen=8: 844 braids
    projlen=9: 1656 braids
    projlen=10: 1658 braids
    projlen=11: 5234 braids
    projlen=12: 3739 braids
  Braids kept: 3604854 (in 24 buckets, 32.09 GB)
  ⚡ Timing: matmul=1.23s, sampling=2.69s, total=18.05s

============================================================
Level 57 - SAMPLING
============================================================
  Starting braids: 650000
  Candidates to generate: 3617066
  Processing in 73 chunks...
  Projlen distribution:
    projlen=5: 135 braids
    projlen=6: 260 braids
    projlen=7: 1309 braids
    projlen=8: 1466 braids
    projlen=9: 3932 braids
    projlen=10: 4057 braids
    projlen=11: 8573 braids
    projlen=12: 8693 braids
    projlen=13: 25789 braids
    projlen=14: 19307 braids
  Braids kept: 3617066 (in 20 buckets, 32.20 GB)
  ⚡ Timing: matmul=1.28s, sampling=3.32s, total=18.78s

============================================================
Level 58 - SAMPLING
============================================================
  Starting braids: 650000
  Candidates to generate: 3594968
  Processing in 72 chunks...
  Projlen distribution:
    projlen=5: 1 braids
    projlen=7: 672 braids
    projlen=8: 1174 braids
    projlen=9: 6458 braids
    projlen=10: 6924 braids
    projlen=11: 19978 braids
    projlen=12: 20180 braids
    projlen=13: 43571 braids
    projlen=14: 44659 braids
    projlen=15: 127492 braids
  Braids kept: 3594968 (in 17 buckets, 32.00 GB)
  ⚡ Timing: matmul=1.30s, sampling=2.64s, total=17.89s

============================================================
Level 59 - SAMPLING
============================================================
  Starting braids: 650000
  Candidates to generate: 3618706
  Processing in 73 chunks...
  Projlen distribution:
    projlen=3: 1 braids
    projlen=4: 1 braids
    projlen=5: 5 braids
    projlen=6: 4 braids
    projlen=7: 11 braids
    projlen=8: 8 braids
    projlen=9: 3180 braids
    projlen=10: 5330 braids
    projlen=11: 30965 braids
    projlen=12: 33293 braids
  Braids kept: 3618706 (in 18 buckets, 32.21 GB)
  ⚡ Timing: matmul=1.24s, sampling=2.75s, total=18.17s

============================================================
Level 60 - SAMPLING
============================================================
  Starting braids: 650000
  Candidates to generate: 3575156
  Processing in 72 chunks...

  🎉 FOUND 1 KERNEL ELEMENTS (projlen=1)! 🎉
  Projlen distribution:
    projlen=1: 1 braids
    projlen=3: 5 braids
    projlen=4: 3 braids
    projlen=5: 16 braids
    projlen=6: 9 braids
    projlen=7: 43 braids
    projlen=8: 25 braids
    projlen=9: 112 braids
    projlen=10: 68 braids
    projlen=11: 14825 braids
  Braids kept: 3575156 (in 18 buckets, 31.83 GB)
  ⚡ Timing: matmul=1.25s, sampling=2.82s, total=18.00s

============================================================
SEARCH COMPLETE
============================================================
Final level: 60
Total time: 1105.53s
Avg time per level: 18.43s
Total matmul time: 71.70s
Total kernel elements: 12
  Saving checkpoint to ./final_state_level_60.pt...

Final state saved to ./final_state_level_60.pt

============================================================
VERIFICATION
============================================================

Batch 0: 6 candidates
  Braid 0: [7, 10, 13, 8, 13, 8, 2, 13]... - Off-diagonal nonzero at [0,2]
  Braid 1: [7, 10, 13, 4, 13, 4, 2, 13]... - Off-diagonal nonzero at [0,2]
  Braid 2: [7, 7, 10, 13, 4, 13, 4, 2]... - Off-diagonal nonzero at [0,2]
  Braid 3: [7, 7, 10, 13, 8, 13, 8, 2]... - Off-diagonal nonzero at [0,2]
  Braid 4: [16, 16, 13, 11, 13, 11, 13, 21]... - Off-diagonal nonzero at [0,2]

Batch 1: 5 candidates
  Braid 0: [7, 7, 7, 10, 13, 4, 13, 4]... - Off-diagonal nonzero at [0,2]

  🎉 KERNEL ELEMENT #1 🎉
    Factors: [21, 7, 10, 13, 4, 13, 4, 2, 13, 20, 13, 20, 13, 10, 2, 13, 4, 13, 4, 13, 7, 21, 20, 13, 20, 13, 10, 16, 16, 2, 13, 4, 13, 4, 13, 21, 20, 13, 20, 13, 21, 10, 13, 4, 13, 4, 2, 16, 13, 11, 13, 11, 13, 21, 10]
    Length: 55
    Kernel element! Evaluates to (v^0) * I
    Artin word: [1, 2, 3, 2, 1, 1, 3, 1, 3, 2, 2, 1, 3, 3, 2, 2, 1, 3, 3, 2, 2, 2, 1, 3, 1, 3, 2, 1, 2, 1, 3, 1, 3, 2, 1, 2, 1, 3, 1, 3, 2, 2, 2, 1, 3, 3, 2, 2, 1, 3, 3, 2, 2, 1, 3, 1, 3, 1, 2, 3, 2, 1, 1, 3, 2, 1, 2, 1, 3, 1, 3, 2, 1, 2, 1, 3, 1, 3, 2, 2, 1, 3, 2, 2, 1, 3, 2, 2, 2, 1, 3, 3, 2, 2, 1, 3, 3, 2, 2, 1, 3, 1, 2, 3, 2, 1, 1, 3, 2, 1, 2, 1, 3, 1, 3, 2, 1, 2, 1, 3, 1, 2, 3, 2, 1, 1, 3, 2, 2, 1, 3, 3, 2, 2, 1, 3, 3, 2, 2, 2, 1, 3, 2, 2, 1, 3, 1, 2, 3, 2, 2, 1, 3, 1, 2, 3, 2, 2, 1, 3, 1, 2, 3, 2, 1, 1, 3, 2]

  🎉 KERNEL ELEMENT #2 🎉
    Factors: [21, 7, 10, 13, 8, 13, 8, 2, 13, 11, 13, 11, 13, 10, 2, 13, 8, 13, 8, 13, 7, 21, 11, 13, 11, 13, 10, 16, 16, 2, 13, 8, 13, 8, 13, 21, 11, 13, 11, 13, 21, 10, 13, 8, 13, 8, 2, 16, 13, 20, 13, 20, 13, 21, 10]
    Length: 55
    Kernel element! Evaluates to (v^0) * I
    Artin word: [1, 2, 3, 2, 1, 1, 3, 1, 3, 2, 2, 1, 3, 1, 2, 2, 1, 3, 1, 2, 2, 2, 1, 3, 1, 2, 3, 2, 2, 1, 3, 1, 2, 3, 2, 2, 1, 3, 1, 3, 2, 2, 2, 1, 3, 1, 2, 2, 1, 3, 1, 2, 2, 1, 3, 1, 3, 1, 2, 3, 2, 1, 1, 2, 3, 2, 2, 1, 3, 1, 2, 3, 2, 2, 1, 3, 1, 3, 2, 2, 1, 3, 2, 2, 1, 3, 2, 2, 2, 1, 3, 1, 2, 2, 1, 3, 1, 2, 2, 1, 3, 1, 2, 3, 2, 1, 1, 2, 3, 2, 2, 1, 3, 1, 2, 3, 2, 2, 1, 3, 1, 2, 3, 2, 1, 1, 3, 2, 2, 1, 3, 1, 2, 2, 1, 3, 1, 2, 2, 2, 1, 3, 2, 2, 1, 3, 1, 3, 2, 1, 2, 1, 3, 1, 3, 2, 1, 2, 1, 3, 1, 2, 3, 2, 1, 1, 3, 2]
  Braid 3: [2, 16, 13, 11, 13, 11, 13, 21]... - Off-diagonal nonzero at [0,2]
  Braid 4: [2, 16, 13, 20, 13, 20, 13, 21]... - Off-diagonal nonzero at [0,2]

Batch 2: 1 candidates

  🎉 KERNEL ELEMENT #3 🎉
    Factors: [13, 8, 13, 21, 11, 13, 11, 13, 10, 2, 13, 8, 13, 8, 13, 21, 11, 13, 11, 13, 10, 2, 13, 8, 13, 8, 13, 21, 11, 13, 11, 13, 10, 2, 13, 8, 13, 8, 13, 21, 11, 13, 11, 13, 10, 2, 13, 8, 13, 8, 13, 21, 11, 13, 11, 13, 10, 2, 13, 8]
    Length: 60
    Kernel element! Evaluates to (v^0) * I
    Artin word: [2, 1, 3, 1, 2, 2, 1, 3, 1, 2, 3, 2, 1, 1, 2, 3, 2, 2, 1, 3, 1, 2, 3, 2, 2, 1, 3, 1, 3, 2, 2, 2, 1, 3, 1, 2, 2, 1, 3, 1, 2, 2, 1, 3, 1, 2, 3, 2, 1, 1, 2, 3, 2, 2, 1, 3, 1, 2, 3, 2, 2, 1, 3, 1, 3, 2, 2, 2, 1, 3, 1, 2, 2, 1, 3, 1, 2, 2, 1, 3, 1, 2, 3, 2, 1, 1, 2, 3, 2, 2, 1, 3, 1, 2, 3, 2, 2, 1, 3, 1, 3, 2, 2, 2, 1, 3, 1, 2, 2, 1, 3, 1, 2, 2, 1, 3, 1, 2, 3, 2, 1, 1, 2, 3, 2, 2, 1, 3, 1, 2, 3, 2, 2, 1, 3, 1, 3, 2, 2, 2, 1, 3, 1, 2, 2, 1, 3, 1, 2, 2, 1, 3, 1, 2, 3, 2, 1, 1, 2, 3, 2, 2, 1, 3, 1, 2, 3, 2, 2, 1, 3, 1, 3, 2, 2, 2, 1, 3, 1, 2]

============================================================
SUMMARY
============================================================
Total candidates with projlen=1: 12
Verified kernel elements: 3

✓ SUCCESS! Found 3 kernel elements for p=5
JOB COMPLETED!
